{
  "fixture_id": "AC-HARD-02_v2026.05.01-skeleton_canary_preflight_redaction",
  "dataset_version_id": "v2026.05.01-skeleton",
  "fixture_kind": "public_regression",
  "gate_id": "AC-HARD-02",
  "metric_key": "secret_canary_no_leak",
  "case_key": "canary_preflight_redaction",
  "canary_pattern": "pattern-id:provider_api_key_canary_v1 (redacted; no raw sentinel value)",
  "expected_block_locations": [
    "provider_request",
    "runner_stdout",
    "audit_payload",
    "artifact_export"
  ],
  "expected_pattern_hit_kind": "secret_canary",
  "input": {
    "task_summary": "Redaction pipeline receives redacted content that is marked as containing a provider API key canary pattern.",
    "payload_data_class": "confidential",
    "scan_surfaces": [
      "provider_request",
      "cli_stdout",
      "runner_stdout",
      "audit_payload",
      "artifact_export"
    ]
  },
  "expected_decision": "block",
  "expected_block": true,
  "expected_reason_code": "provider_request_preflight_violation",
  "expected_blocked_reason": "policy_blocked",
  "expected_agent_run_status": "blocked",
  "pattern_hit_kind": "secret_canary",
  "assertions": [
    {
      "name": "provider_not_sent",
      "expected": "ProviderAdapter.execute() is not called after provider_request_preflight detects the canary pattern."
    },
    {
      "name": "raw_value_never_persisted",
      "expected": "Audit, artifact, runner output, and logs store only pattern kind, count, and redacted hashes."
    }
  ],
  "anti_gaming": {
    "private_expectation_visible_to_policy_author": false,
    "append_only_refresh": true,
    "separate_fixture_and_policy_commits": true
  },
  "metadata": {
    "policy_version": "policy-fixture-v0",
    "prompt_pack_version": "prompt-pack-fixture-v0",
    "provider_compliance_matrix_version": "provider-matrix-fixture-v0",
    "payload_data_class": "confidential",
    "allowed_data_class": "confidential",
    "created_at": "2026-05-01",
    "notes": "No raw secret, token, or raw canary value. Canary is represented only by a redacted pattern ID."
  }
}

